Category,Component,Issue_Type,Severity,Description,Recommendation,File_Location,Priority
Post-Consolidation Architecture,Test Infrastructure,Strength,Low,Successfully consolidated 4 test executables into unified test runner reducing binary count by 50%,Maintain parameter-driven design pattern for future test extensions,src/test_runner.zig,P3
Post-Consolidation Architecture,Binary Reduction,Strength,Low,Eliminated redundant ctx-unit-csv and ctx-performance binaries while preserving all functionality through parameters,Document parameter-driven design patterns for team adoption,build.zig:lines 113-129,P3
Post-Consolidation Architecture,Parameter Design,Strength,Low,Clean parameter-driven architecture with --type --format and --output flags providing flexible test execution,Extend pattern to other potential multi-mode utilities,src/test_runner.zig:lines 8-24,P3
Post-Consolidation Architecture,Build System Simplification,Strength,Low,Build targets now use single executable with different parameters instead of maintaining separate binaries,Continue this pattern for other complex build scenarios,build.zig:lines 113-129,P3
Post-Consolidation Architecture,Code Elimination,Strength,Low,Successfully removed duplicate unit_tests_enhanced.zig file eliminating maintenance overhead,Implement process to prevent future test duplication,Former src/unit_tests_enhanced.zig,P3
Code Quality Improvements,Duplication Elimination,Strength,Low,Consolidated test infrastructure eliminates argument parsing duplication across multiple main() functions,Maintain single source of truth for similar functionality,src/test_runner.zig:lines 46-107,P3
Code Quality Improvements,Function Complexity,Issue,High,captureCurrentContext function still has multiple responsibilities combining git branch capture environment collection and file discovery,Extract separate functions for each capture operation to improve testability,src/context.zig:lines 59-75,P1
Code Quality Improvements,Error Handling Consistency,Strength,Low,Unified test runner provides consistent error handling across all test types with proper argument validation,Maintain consistent error patterns in new parameter additions,src/test_runner.zig:lines 60-101,P3
Code Quality Improvements,Memory Management,Strength,Low,Consistent GeneralPurposeAllocator usage across consolidated architecture with proper cleanup patterns,Ensure new test types follow same memory management patterns,src/test_runner.zig:lines 110-112,P3
Code Quality Improvements,Technical Debt Reduction,Strength,Low,Consolidation eliminated placeholder binaries and focused implementation in unified location,Continue eliminating placeholder/incomplete implementations,src/test_runner.zig,P3
Testing Infrastructure Maturity,Unified Test Runner,Strength,Low,Comprehensive test runner supporting unit performance and combined test execution with proper timing,Add integration test type to complete test type coverage,src/test_runner.zig:lines 127-141,P2
Testing Infrastructure Maturity,CSV Output Implementation,Strength,Low,Properly implemented CSV output with correct headers and escaping for all test types,Consider adding additional output formats (JSON XML) using same pattern,src/test_runner.zig:lines 174-184,P3
Testing Infrastructure Maturity,Container Testing Integration,Issue,Medium,Container testing workflow exists but integration with unified test runner not yet optimized,Update container scripts to use unified test runner instead of individual binaries,scripts/podman_test.zig,P2
Testing Infrastructure Maturity,Test Organization,Strength,Low,Clean separation between test definition (unit_tests.zig) and test execution (test_runner.zig) with proper public interfaces,Maintain this separation when adding new test modules,src/unit_tests.zig and src/test_runner.zig,P3
Testing Infrastructure Maturity,Performance Test Integration,Strength,Low,Performance tests properly integrated into unified runner with nanosecond precision preserved,Expand performance test coverage for critical path operations,src/performance_tests.zig,P3
Documentation Accuracy,Post-Consolidation Updates,Issue,High,CLAUDE.md still references non-existent run_csv_tests.sh script after consolidation,Update documentation to reflect unified test runner usage instead of missing script,CLAUDE.md:line 15,P1
Documentation Accuracy,Architecture Alignment,Issue,Medium,Documentation doesn't reflect the successful binary consolidation and parameter-driven design,Update architecture documentation to highlight consolidation benefits,ARCHITECTURE.md,P2
Documentation Accuracy,Command Reference,Issue,Medium,Build command documentation needs update to reflect new parameter-based test execution patterns,Add examples showing unified test runner usage patterns,CLAUDE.md:lines 11-16,P2
Documentation Accuracy,User Experience,Strength,Low,Unified test runner provides comprehensive --help documentation improving discoverability,Maintain high-quality help text for all command-line tools,src/test_runner.zig:lines 26-44,P3
Documentation Accuracy,Consistency Check,Issue,Low,Some references to old binary names may still exist in comments or documentation,Audit all files for references to removed binaries,All files,P3
Maintainability Factors,Extension Capability,Strength,Low,Adding new test types requires only parameter additions and import statements rather than new binaries,Document the process for adding new test types to unified runner,src/test_runner.zig:lines 8-12,P3
Maintainability Factors,Parameter Extension,Strength,Low,Clean parameter parsing allows easy addition of new flags without breaking existing functionality,Use same parsing pattern for other command-line tools in the project,src/test_runner.zig:lines 53-104,P3
Maintainability Factors,Code Organization,Strength,Low,Clear separation between test execution logic and output formatting enhances maintainability,Apply similar separation patterns to other modules with multiple responsibilities,src/test_runner.zig:lines 167-198,P3
Maintainability Factors,Development Workflow,Strength,Low,Unified test runner simplifies development workflow by providing single interface for all test operations,Document workflow improvements for team adoption,src/test_runner.zig,P3
Maintainability Factors,Build Complexity,Strength,Low,Simplified build system with parameter-driven steps reduces build maintenance overhead,Consider applying parameter patterns to other build complexities,build.zig:lines 113-129,P3
Build System Evolution,Target Consolidation,Strength,Low,Build targets successfully consolidated while maintaining backward compatibility with existing commands,Evaluate other build targets for similar consolidation opportunities,build.zig,P3
Build System Evolution,Dependency Management,Strength,Low,No new dependencies introduced during consolidation maintaining minimal dependency footprint,Continue consolidation efforts without adding external dependencies,build.zig.zon,P3
Build System Evolution,Performance Impact,Strength,Low,Consolidated build process shows no performance degradation while reducing build complexity,Monitor build performance as consolidation pattern is extended,build.zig,P3
Build System Evolution,Deployment Simplification,Strength,Low,Reduced binary count simplifies deployment and distribution while maintaining all functionality,Update deployment documentation to reflect simplified binary set,build.zig,P3
Architecture Quality Assessment,Module Boundaries,Strength,Low,Consolidation maintains clean module boundaries while reducing interface complexity,Preserve module separation when extending unified components,All source files,P3
Architecture Quality Assessment,Interface Design,Strength,Low,Unified test runner provides clean CLI interface following Unix philosophy of parameter-based configuration,Apply similar interface design to other multi-mode utilities,src/test_runner.zig:lines 26-44,P3
Architecture Quality Assessment,Extensibility Pattern,Strength,Low,Parameter-driven design establishes excellent pattern for future feature extensions without binary proliferation,Document and evangelize this pattern for team-wide adoption,src/test_runner.zig,P2
Architecture Quality Assessment,Backward Compatibility,Strength,Low,All existing zig build commands continue to work despite underlying consolidation,Maintain backward compatibility commitment in future consolidations,build.zig:lines 85-129,P3
Long-term Maintainability,Complexity Reduction,Strength,Low,Overall system complexity reduced through elimination of redundant binaries and code paths,Continue identifying and eliminating unnecessary complexity,All files,P3
Long-term Maintainability,Team Onboarding,Strength,Low,Unified test interface reduces cognitive load for new team members learning the test system,Create team documentation highlighting simplified test workflows,src/test_runner.zig,P2
Long-term Maintainability,Future Extensions,Strength,Low,Consolidation establishes clear patterns for extending test functionality without architectural changes,Plan future test types using established parameter patterns,src/test_runner.zig,P3
Long-term Maintainability,Code Evolution,Strength,Low,Unified architecture provides single point of enhancement for test infrastructure improvements,Prioritize enhancements to unified components over scattered improvements,src/test_runner.zig,P3
Remaining Opportunities,Further Consolidation,Issue,Medium,Potential for consolidating ctx-test blackbox runner into unified test runner for complete test unification,Evaluate feasibility of adding blackbox tests as another --type parameter,src/test.zig and src/test_runner.zig,P2
Remaining Opportunities,Performance Monitoring,Issue,Low,No automated tracking of consolidation benefits like build time reduction or deployment simplification,Implement metrics to track consolidation benefits for future decisions,build.zig,P3
Remaining Opportunities,Pattern Documentation,Issue,Medium,Successful consolidation pattern not formally documented for reuse in other projects or modules,Create formal documentation of parameter-driven consolidation pattern,Documentation files,P2
Remaining Opportunities,Container Optimization,Issue,Medium,Container testing scripts not yet optimized for unified test runner potentially missing efficiency gains,Update container workflows to leverage unified test runner capabilities,scripts/podman_test.zig,P2
Security Considerations,Parameter Validation,Strength,Low,Unified test runner properly validates all parameters preventing injection through command-line arguments,Maintain strict parameter validation for all CLI tools,src/test_runner.zig:lines 60-101,P3
Security Considerations,File Output Security,Strength,Low,CSV file output uses safe file creation patterns without security vulnerabilities,Apply same secure file handling patterns to other file operations,src/test_runner.zig:lines 168-171,P3
Security Considerations,Input Sanitization,Issue,Low,Command-line parameter parsing could benefit from additional sanitization for file paths,Add file path validation for --output parameter,src/test_runner.zig:lines 91-97,P3
Performance Considerations,Runtime Efficiency,Strength,Low,Unified test runner shows no performance regression while providing more functionality than separate binaries,Monitor performance characteristics as unified runner is extended,src/test_runner.zig,P3
Performance Considerations,Memory Usage,Strength,Low,Single binary approach reduces memory overhead compared to multiple separate test executables,Evaluate memory usage patterns for other consolidation candidates,src/test_runner.zig:lines 110-112,P3
Performance Considerations,Build Time Impact,Strength,Low,Consolidation reduces overall build time by eliminating duplicate compilation of similar functionality,Measure and document build time improvements for consolidation ROI,build.zig,P3