Category,Component,Issue_Type,Severity,Description,Recommendation,File_Location,Priority
Architecture,Module Design,Strength,Low,Clean modular architecture with well-defined boundaries between CLI parsing (main.zig) and business logic (context.zig) and persistence (storage.zig),Continue maintaining clear separation of concerns,src/main.zig,P3
Architecture,Module Design,Strength,Low,Context struct and ContextManager provide clear abstraction boundaries with proper encapsulation,Preserve the clean API design when adding new features,src/context.zig,P3
Architecture,Dependency Management,Strength,Low,Single external dependency (clap) kept minimal and well-contained,Consider periodic review of dependency updates for security,build.zig.zon,P3
Architecture,Code Organization,Issue,Medium,Missing run_csv_tests.sh script referenced in CLAUDE.md documentation,Remove reference or implement the missing script for CSV test execution,CLAUDE.md:line 15,P2
Architecture,Memory Management,Strength,Low,Consistent use of GeneralPurposeAllocator with proper cleanup patterns throughout codebase,Maintain consistent allocation patterns in new code,src/main.zig:lines 46-47,P3
Code Quality,Error Handling,Strength,Low,Comprehensive error handling with user-friendly error messages using printParseError function,Continue pattern of translating technical errors to user-friendly messages,src/context.zig:lines 200-211,P3
Code Quality,Error Handling,Issue,Medium,Mixed error handling patterns - some functions use early returns while others use switch statements,Standardize on one error handling pattern for consistency,src/context.zig:lines 87-93,P2
Code Quality,Function Complexity,Strength,Low,Functions are generally small and focused - main command switch is clean and readable,Maintain single responsibility principle when adding new commands,src/main.zig:lines 99-127,P3
Code Quality,Function Complexity,Issue,High,captureCurrentContext function has multiple responsibilities and complex fallback logic,Extract separate functions for git branch capture environment variable collection and file discovery,src/context.zig:lines 59-72,P1
Code Quality,Naming Conventions,Strength,Low,Consistent snake_case for functions and variables PascalCase for types,Maintain naming consistency in new code,All source files,P3
Code Quality,Code Duplication,Issue,Medium,Directory validation logic appears in both validateDirectory function and inline in generateRestoreCommands,Extract common directory validation to a shared utility function,src/context.zig:lines 254-267,P2
Code Quality,Constants Management,Strength,Low,Well-organized configuration constants in dedicated config.zig module,Continue centralizing configuration rather than using magic numbers,src/config.zig,P3
Testing,Test Structure,Strength,Low,Multiple test types (unit integration blackbox performance) provide comprehensive coverage,Maintain the multi-layered testing approach,src/unit_tests.zig,P3
Testing,Test Structure,Issue,Medium,Duplicated test infrastructure with both unit_tests.zig and unit_tests_enhanced.zig containing similar test cases,Consolidate test infrastructure to avoid maintenance overhead,src/unit_tests.zig and src/unit_tests_enhanced.zig,P2
Testing,CSV Support,Issue,High,CSV test output support is incomplete - unit_tests_enhanced.zig exists but no CSV generation logic implemented,Implement actual CSV output generation in enhanced test files,src/unit_tests_enhanced.zig,P1
Testing,Test Coverage,Issue,Medium,Missing unit tests for storage.zig module functions like duplicateStringSlice and duplicateEnvVars,Add comprehensive unit tests for storage module helper functions,src/storage.zig,P2
Testing,Test Coverage,Issue,Low,Shell detection testing only validates that function doesn't crash - no environment mocking,Consider adding more robust shell detection tests with environment mocking,src/unit_tests.zig:lines 92-102,P3
Testing,Performance Tests,Issue,Medium,Performance test infrastructure referenced in build.zig but .performance.test.zig may not have actual benchmark implementations,Implement concrete performance benchmarks for critical operations,src/.performance.test.zig,P2
Documentation,Accuracy,Issue,High,CLAUDE.md references run_csv_tests.sh script that doesn't exist in the codebase,Remove reference or implement the missing script,CLAUDE.md:line 15,P1
Documentation,Accuracy,Issue,Medium,ARCHITECTURE.md claims root.zig creates a library module but it's not used in main executable,Update documentation to reflect actual build architecture or implement library usage,ARCHITECTURE.md:lines 32-35,P2
Documentation,Accuracy,Issue,Low,Build command references in documentation don't match all available build targets in build.zig,Synchronize documentation with actual build.zig targets,CLAUDE.md and build.zig,P3
Documentation,Completeness,Strength,Low,Comprehensive architecture documentation with clear module boundaries and responsibilities,Maintain documentation quality when refactoring,ARCHITECTURE.md,P3
Documentation,Completeness,Issue,Medium,Missing inline code documentation for complex functions like captureCurrentContext and generateRestoreCommands,Add function-level documentation for complex business logic,src/context.zig,P2
Build System,Configuration,Strength,Low,Clean build.zig with well-organized build targets and proper dependency management,Maintain build system clarity when adding new targets,build.zig,P3
Build System,Configuration,Issue,Medium,Unused lib_mod referenced in CLAUDE.md but not actually created in build.zig,Either implement library module or remove documentation references,build.zig and CLAUDE.md,P2
Build System,Dependency Management,Strength,Low,Single external dependency (clap 0.10.0) is pinned to specific version,Continue pinning dependencies for reproducible builds,build.zig.zon,P3
Build System,Build Targets,Issue,Low,Build target naming inconsistency - some use test-unit-csv others use test-unit-enhanced,Standardize build target naming convention,build.zig:lines 115-119,P3
Build System,Performance,Issue,Medium,No build optimization flags documented for release builds,Document recommended release build flags for production deployment,CLAUDE.md,P2
Maintainability,Extensibility,Strength,Low,Context struct design allows easy addition of new fields through JSON serialization,Plan new context fields carefully to maintain backward compatibility,src/validation.zig:lines 22-54,P3
Maintainability,Extensibility,Issue,Medium,Hard-coded shell types in enum require code changes to support new shells,Consider configuration-driven shell support for easier extension,src/shell.zig:lines 7-14,P2
Maintainability,Debugging,Strength,Low,Comprehensive error messages with emojis and context information aid debugging,Maintain user-friendly error reporting in new features,Various files,P3
Maintainability,Debugging,Issue,Medium,Limited logging infrastructure - debugging complex context operations could be difficult,Implement optional debug logging for troubleshooting context save/restore operations,src/context.zig,P2
Maintainability,Code Evolution,Issue,High,generateRestoreCommands function mixes business logic with shell output generation,Separate command generation from output formatting for better testability,src/context.zig:lines 214-251,P1
Maintainability,Onboarding,Strength,Low,Clear project structure with consistent patterns makes codebase approachable,Document common development patterns for new contributors,All files,P3
Maintainability,Onboarding,Issue,Medium,Mixed inline vs separate module patterns - some logic inlined into context.zig that could be modular,Consider extracting command generation into separate module for consistency,src/context.zig:lines 214-251,P2
Container Infrastructure,Build Scripts,Issue,Medium,Container build scripts (podman_build.zig) referenced but their integration with CI/CD pipeline not documented,Document container build workflow and CI/CD integration patterns,scripts/podman_build.zig,P2
Container Infrastructure,Testing,Issue,Low,Container testing workflow exists but no validation of container behavior vs local behavior,Add tests to ensure container and local environments produce identical results,scripts/podman_test.zig,P3
Performance,Memory Management,Strength,Low,Proper use of arena allocators in tests and consistent cleanup patterns,Continue using arena allocators for temporary operations,src/unit_tests.zig,P3
Performance,Memory Management,Issue,Medium,Context deserialization creates deep copies which may be inefficient for large contexts,Consider lazy loading or reference counting for large context data,src/storage.zig:lines 68-77,P2
Performance,File Operations,Strength,Low,Atomic file operations with temp files ensure data integrity,Maintain atomic operations for critical data persistence,src/storage.zig:lines 46-55,P3
Performance,File Operations,Issue,Low,No file size validation before attempting to load contexts could cause memory issues,Add file size checks before loading context files,src/storage.zig:lines 62-63,P3
Security,Input Validation,Strength,Low,Comprehensive input validation for context names and environment variables,Maintain strict input validation for all user-provided data,src/validation.zig,P3
Security,Input Validation,Issue,Medium,Git branch validation is minimal - malicious branch names could cause command injection,Implement stricter git branch name validation and sanitization,src/validation.zig:lines 103-110,P2
Security,File Operations,Strength,Low,Context files stored in user home directory with appropriate file permissions,Maintain secure file storage practices,src/storage.zig,P3
Security,File Operations,Issue,Low,No explicit file permission setting for context files - relies on umask,Set explicit file permissions for context files to ensure privacy,src/storage.zig:lines 151-155,P3
Code Quality,Technical Debt,Issue,Medium,Placeholder functions for getOpenFiles and getRecentCommands indicate incomplete feature implementation,Either implement these features or remove placeholder code to avoid confusion,src/context.zig:lines 161-190,P2
Code Quality,Technical Debt,Issue,Low,Multiple TODO-style comments in shell detection could indicate areas needing improvement,Review and resolve TODO-style comments or convert to tracked issues,src/shell.zig,P3
Build System,Tooling,Issue,Medium,CSV test output tooling referenced in architecture docs but implementation may be incomplete,Complete CSV output implementation or clarify current capabilities,ARCHITECTURE.md:lines 125-139,P2
Build System,Tooling,Strength,Low,Container-based testing provides environment isolation and reproducibility,Maintain container testing for critical release validation,scripts/,P3
